<?xml version="1.0" encoding="UTF-8"?>
<RegistoCirurgias 
    xmlns:xsi="http://www.w3.org/2001/XMLSchema-instance"
    xsi:noNamespaceSchemaLocation="cirurgias.xsd">
    
    <Cabecalho>
        <HospitalID>HOSP_001</HospitalID>
        
        <RegistoID>CIR_HOSP_001_202510</RegistoID> 
        
        <PeriodoReferencia>
            <Mes>10</Mes>
            <Ano>2025</Ano>
        </PeriodoReferencia>
    </Cabecalho>
    
    <CirurgiaRegisto>
        <EspecialidadeCirurgica>Ortopedia</EspecialidadeCirurgica>
        
        <ListasEspera>
            <Geral>
                <UtentesEmLista>800</UtentesEmLista>
            </Geral>
            <NaoOncologica>
                <UtentesEmLista>780</UtentesEmLista>
            </NaoOncologica>
            <Oncologica>
                <UtentesEmLista>20</UtentesEmLista>
            </Oncologica>
        </ListasEspera>
        
        <TempoMedioEsperaProgramada>
            <TME_dias>180</TME_dias>
        </TempoMedioEsperaProgramada>
        
    </CirurgiaRegisto>
    
</RegistoCirurgias>